{
  "$schema": "../../../schema/provider.v1.schema.json",
  "id": "deepgram",
  "type": "stt",
  "name": "Deepgram",
  "description": "Streaming speech to text over a websocket, with interim results.",
  "docs_url": "https://developers.deepgram.com/docs/models-languages-overview",
  "env": ["DEEPGRAM_API_KEY"],
  "params": {
    "type": "object",
    "additionalProperties": false,
    "properties": {
      "model": {
        "title": "Model",
        "type": "string",
        "default": "nova-3",
        "examples": ["nova-3", "nova-3-medical", "nova-2"]
      },
      "language": {
        "title": "Language",
        "description": "BCP-47 language code, e.g. \"en\", \"en-US\", \"es\". Use \"multi\" for multilingual Nova-3.",
        "type": "string",
        "default": "en"
      },
      "smart_format": {
        "title": "Smart format",
        "description": "Format numbers, dates and currency in transcripts.",
        "type": "boolean",
        "default": false
      },
      "keyterms": {
        "title": "Key terms",
        "description": "Words the model should listen out for, such as product names (Nova-3 only).",
        "type": "array",
        "items": { "type": "string", "minLength": 1 },
        "default": []
      }
    }
  }
}
